{
  "contract_id": "RELEASE_A_A8_PACKAGE_MANIFEST_CONTRACT_v1.0",
  "contract_sha256": "f5acad2896c767b80bd75a951ea933cc1d2c319a9580aa560e46db46e824cf78",
  "status": "FROZEN_v1.0",
  "package_id": "RELEASE_A_A8_PRODUCT_POPULATION_RELEASE_PACKAGE_v1.0",
  "census_registered_at": "2026-09-26T17:00:00Z",
  "analysis_universe_id": "RAU-feb22ac8e7bc2f9ee644ecc2682e974eb73a40bfc5dccfc2ce2f3ee37abd774e",
  "world_time_cutoff": "2026-09-24",
  "knowledge_time_cutoff": "2026-10-24T23:59:59Z",
  "a2_checkpoint_id": "RELEASE_A_A2_BOUNDED_FRAME_CHECKPOINT_v1.0",
  "a2_checkpoint_sha256": "452c8c504990c05edd6ac7c29b542a49ffa4fd81ccdece2bd7ca8e9e0921ca32",
  "observed_offering_set_sha256": "21034ecec898f81f27ad143282967354315b5b31f9eaf430334ca172186c26c0",
  "n_observed_declared": 6,
  "population_view_id": "A-P1",
  "frame_register_version": "PRODUCT_DISCOVERY_FRAME_REGISTER_v1.0",
  "frame_register_blob_sha": "bb3d95226dc0ed528e5eed8e6de707430399b9ae",
  "predeclaration_rule": "Bind required A8 package components, claim-class separations, forbidden claim classes, headline denominator/population-view rules, D4 version-only binding, and exact upstream digests before package materialization. Post-hoc invention of forbidden claim classes or unqualified product counts after seeing package contents is prohibited. Freeze alone does not emit the package or start A-G.",
  "upstream_digest_bindings": {
    "product_registry_resource": "RELEASE_A_SEED_PRODUCT_REGISTRY.v1.0.json",
    "product_registry_sha256": "9ba43d5614fb1ebb668c097a20c2279dbaaa74511956c16ee6f278cbfc109672",
    "product_identity_registry_id": "RELEASE_A_PRODUCT_IDENTITY_REGISTRY_v1.0",
    "product_identity_registry_sha256": "65023d77ca9187ef068a40366c919e858149054764d06a7146e2282768e0fadc",
    "d4_reference_standard_id": "D4_PRODUCT_REFERENCE_STANDARD_v1.0",
    "d4_reference_standard_version": "1.0",
    "frame_register_version": "PRODUCT_DISCOVERY_FRAME_REGISTER_v1.0",
    "frame_register_blob_sha": "bb3d95226dc0ed528e5eed8e6de707430399b9ae",
    "f9_completion_ledger_id": "RELEASE_A_F9_ACTOR_COMPLETION_LEDGER_008_v1.0",
    "f9_completion_ledger_sha256": "8ed73ad8e53c341f28a749527e5cc6e7277b5a37ba205231ed8219d24c27fc9e",
    "language_jurisdiction_strata_id": "RELEASE_A_LANGUAGE_JURISDICTION_STRATA_v1.0",
    "language_jurisdiction_strata_sha256": "250102995796c6feff792acf6d7616e3d28b8c8bbefc10f1b15af5cbeafc24f4",
    "a3_preregistration_id": "RELEASE_A_A3_CAPABILITY_RECALL_PREREGISTRATION_v1.0",
    "a3_preregistration_sha256": "96feb85999f66c80f82ecafb0592db8cb5a00b957668bb01da63e8ccdd069a76",
    "a3_study_id": "RELEASE_A_A3_CAPABILITY_FIRST_RECALL_STUDY_v1.0",
    "a3_study_sha256": "b7a6cd6b509f1fa3b8481fbd821589b8f7c1eaf40cec8c14df992e38360285d8",
    "a4_preregistration_id": "RELEASE_A_A4_MULTILINGUAL_SENSITIVITY_PREREGISTRATION_v1.0",
    "a4_preregistration_sha256": "1ee891d1fc2641f2eadaa015c2d95a9983241696233da5a93fc401b5b56bba23",
    "a4_study_id": "RELEASE_A_A4_MULTILINGUAL_COVERAGE_SENSITIVITY_STUDY_v1.0",
    "a4_study_sha256": "a82fc5081630fc0af2d8843e6ad6009a9cbcb544509ce31f2a7b1fc94d8236ed",
    "a5_preregistration_id": "RELEASE_A_A5_SNOWBALL_DISCOVERY_PREREGISTRATION_v1.0",
    "a5_preregistration_sha256": "127e4ba8fb17ce071ad50a8ef628125031b6625bcda27f812bbaf26d8ca114ad",
    "a5_study_id": "RELEASE_A_A5_CONTROLLED_SNOWBALL_DISCOVERY_STUDY_v1.0",
    "a5_study_sha256": "b8279338c577c54fc5674c08324b95272a20e992a8240b11f7d542cbc55c3cbd",
    "a6_preregistration_id": "RELEASE_A_A6_COVERAGE_SATURATION_PREREGISTRATION_v1.0",
    "a6_preregistration_sha256": "5edcea38f40a4874bdc5404add331a888730277982315f66b5c4cf53c37be00d",
    "a6_study_id": "RELEASE_A_A6_PRODUCT_DISCOVERY_COVERAGE_SATURATION_REPORT_v1.0",
    "a6_study_sha256": "eb865319d27fb9904e1b1ad7685372e077445488236097f1e8d3f6814ead5b6b",
    "a7_capture_history_id": "RELEASE_A_A7_CAPTURE_HISTORY_DATASET_v1.0",
    "a7_capture_history_sha256": "f3718778dada33bafd55c7d2ce45aa0305eb04db15ffad85c2306393004d0af8",
    "a7_model_specification_id": "RELEASE_A_A7_POPULATION_MODEL_SPECIFICATION_v1.0",
    "a7_model_specification_sha256": "9986bb58515955a53962df6bae5d79e250a9c9076c74f030347c82f52d3ce04b",
    "a7_eligible_capture_records_sha256": "c1c1eb216285941085a4f158cbcf0d076216e36f9646a98f4fa841da0f327851",
    "a7_estimation_report_id": "RELEASE_A_A7_PRODUCT_POPULATION_ESTIMATION_REPORT_v1.0",
    "a7_estimation_report_sha256": "a533cc52517f8611770910597a83a60745fbb7d781ac73f2a7b3890031d371eb",
    "a7_study_id": "RELEASE_A_A7_PRODUCT_POPULATION_ESTIMATION_REPORT_v1.0"
  },
  "required_package_components": [
    "PRODUCT_REGISTRY",
    "D4_REFERENCE_STANDARD_SUMMARY",
    "DISCOVERY_FRAME_REGISTER",
    "A3_CAPABILITY_FIRST_RECALL_STUDY",
    "A4_MULTILINGUAL_COVERAGE_SENSITIVITY_REPORT",
    "A6_COVERAGE_SATURATION_REPORT",
    "A7_POPULATION_ESTIMATION_REPORT",
    "ANALYTICAL_WORKBOOK_FIGURE_DATA",
    "SOURCE_COVERAGE_UNCERTAINTY_REGISTER",
    "EXPLICIT_UNKNOWN_UNRESOLVED_REGISTER"
  ],
  "claim_classes": [
    "OBSERVED_FACT",
    "DERIVED_QUANTITATIVE_RESULT",
    "BOUNDED_INFERENCE",
    "POLICY_INTERPRETATION"
  ],
  "forbidden_claim_classes": [
    "MARKET_SHARE",
    "COMPARATIVE_EFFECTIVENESS",
    "NATIONAL_LEADERSHIP",
    "UNQUALIFIED_HETEROGENEOUS_PRODUCT_COUNT",
    "INVENTED_N_ESTIMATED",
    "F9_EXHAUSTION_AS_GLOBAL_COMPLETENESS",
    "OPEN_WORLD_SATURATION_AS_CENSUS",
    "GLOBAL_PRODUCT_CENSUS"
  ],
  "headline_count_rules": {
    "every_headline_must_name_denominator": true,
    "every_headline_must_name_population_view": true,
    "heterogeneous_inventory_is_not_unqualified_product_count": true,
    "offering_role_mix_requires_explicit_role_breakdown": true,
    "primary_population_view_id": "A-P1",
    "primary_denominator_label": "distinct resolved in-scope canonical PRODUCT/OFFERING identities under A-P1"
  },
  "d4_binding_policy": {
    "reference_standard_id": "D4_PRODUCT_REFERENCE_STANDARD_v1.0",
    "reference_standard_version": "1.0",
    "bind_version_and_working_summary_only": true,
    "do_not_invent_d4_case_results": true,
    "working_distribution": {
      "INCLUDE": 49,
      "EXCLUDE": 11,
      "BORDERLINE": 0,
      "ABSTAIN": 0,
      "TOTAL": 60
    },
    "source_doc": "docs/methodology/d4-product-reference-standard-v1.0.md"
  },
  "a7_fail_closed_preservation": {
    "n_observed": 6,
    "n_estimated": null,
    "estimation_outcome": "FAIL_CLOSED",
    "fail_closed_outcome": "NO_DEFENSIBLE_UNSEEN_POPULATION_ESTIMATE_UNDER_PREREGISTERED_ACCEPTANCE_CRITERIA",
    "observed_count_reported_separately_from_estimate": true,
    "forbid_invented_n_estimated": true
  },
  "execution_gate": {
    "requires_frozen_contract_before_package": true,
    "freeze_alone_does_not_emit_package": true,
    "does_not_start_ag": true,
    "does_not_mutate_rau": true,
    "does_not_allocate_canonical_identity": true,
    "does_not_reopen_closed_discovery_fitting": true,
    "does_not_start_release_b_c_d": true,
    "preserves_a7_fail_closed": true,
    "forbids_market_share_comparative_effectiveness_national_leadership": true,
    "f9_exhaustion_is_not_global_completeness": true,
    "open_world_saturation_is_not_census": true
  },
  "boundary": "A8 package-manifest contract freezes required Release-A package components, claim-class separations, forbidden claim classes, headline-denominator rules, and exact upstream digest bindings before package materialization. It does not establish market share, comparative effectiveness, national leadership, global completeness, S2 publication authority, or v4.2 assessment effect. Freeze alone does not emit the Product Population Release Package. A7 fail-closed N_observed=6 with no N_estimated is preserved. F9 exhaustion is not global completeness; open-world saturation is not a census. Does not start A-G."
}
